{
  "schemaVersion": 1,
  "id": "authoring-agent-onboarding-pr-5",
  "episodeId": "authoring-agent-onboarding",
  "candidate": {
    "revision": "cbb0647c4fc4676e4df3e1e8caf06a9a62b96e1a",
    "baselineRevision": "24d4ed8cea927da16abf9f99297168c4f2cdc550",
    "branch": "feature/authoring-agent-onboarding",
    "pullRequest": "https://github.com/kukhta-ai/work-package-manager/pull/5"
  },
  "verdict": "waived",
  "checks": [
    {
      "name": "process-artifact-policy",
      "status": "passed",
      "evidence": [
        "npm run check:process-artifacts: PASS (1 evolution record, 2 gate receipts)",
        "npm run check:process-artifacts:ci: PASS for the staged TASK-135 closeout candidate",
        "git ls-files '_bmad-output/**' 'Skills-Results/**': no tracked paths"
      ]
    },
    {
      "name": "typecheck",
      "status": "passed",
      "evidence": ["npm run typecheck: exit 0"]
    },
    {
      "name": "biome",
      "status": "passed",
      "evidence": ["npm run lint:ci passed in the exact clean-clone gate"]
    },
    {
      "name": "package-and-build",
      "status": "passed",
      "evidence": [
        "npm run package:inspect -- --revision HEAD accepted wpm 0.1.0 with clean source binding and zero violations",
        "npm run build passed in the exact clean-clone gate"
      ]
    },
    {
      "name": "vitest",
      "status": "passed",
      "evidence": [
        "product/test revision 0c274772dda6decf6116dde0751552bc424b505a passed 142/142 files; 1991 passed, 1 skipped, 0 failed in 1958.37 seconds",
        "candidate cbb0647c4fc4676e4df3e1e8caf06a9a62b96e1a changes no executable source or test behavior after that exact gate"
      ]
    },
    {
      "name": "pull-request-ci-matrix",
      "status": "passed",
      "evidence": [
        "push CI run 33247086890 passed Node 20 and 22 on Ubuntu, macOS, and Windows for exact candidate cbb0647c4fc4676e4df3e1e8caf06a9a62b96e1a",
        "pull-request CI run 33247089431 independently passed the same six cells on the same candidate"
      ]
    },
    {
      "name": "human-review",
      "status": "passed",
      "evidence": [
        "project user explicitly authorized PR #5 merge into dev after green current-tip CI on 2026-08-28 and requested the merge on 2026-08-29"
      ]
    },
    {
      "name": "authenticated-claude-parity",
      "status": "waived",
      "waiverId": "authenticated-claude-parity",
      "evidence": [
        "0/24 required Claude behavioral subruns executed after OAuth expiry",
        "No Claude behavioral acceptance is claimed"
      ]
    }
  ],
  "waivers": [
    {
      "id": "authenticated-claude-parity",
      "scope": "NFR8 authenticated Claude six-skill parity",
      "authority": "human",
      "approvedBy": "project user",
      "approvedAt": "2026-08-25",
      "limitation": "Zero of 24 cells executed after OAuth expiry; no Claude behavioral acceptance is claimed.",
      "evidence": [
        "git:9d28f96903cb3cf9b9cb8765f4f33fd76d07af39:_bmad-output/test-artifacts/gate-decision-authoring-agent-onboarding-complete.json"
      ]
    }
  ],
  "residualRisks": [
    "Authenticated Claude behavioral parity remains unproven until a human reauthenticates and all 24 fresh subruns execute.",
    "The underlying architecture is provisional and emerged from an autonomous experimental SDLC pipeline; this candidate is a make-it-exist-first research baseline, not a claim of architectural maturity, release readiness, or a settled destination.",
    "This receipt is committed after its bound candidate and changes no executable source or test behavior.",
    "npm ci reports three existing high-severity development-dependency advisories; the prescribed gate and production-dependency audit boundary remain unaffected."
  ],
  "preCleanupRevision": "cbb0647c4fc4676e4df3e1e8caf06a9a62b96e1a",
  "updatedAt": "2026-08-29T11:59:55Z"
}
